name,title,description,datatype,required
providerId,Ідентифікатор,Код ЄДРПОУ постачальника послуг з управління побутовими відходами. Наприклад: 01234567. Дані реєстраційного номера облікової картки платника податків фізичної особи-підприємця знеособлюються. ,string,True
providerNname,Назва,Повна назва постачальника послуг. Наприклад: Комунальне підприємство «Благоустрій»,string,True
unitAmountValue,Вартість,Вартість за одиницю у гривнях з ПДВ (лише число). Наприклад: 100. Десяткові значення відділяються крапкою. Наприклад: 5.50. ,decimal,True
currencyCode,Валюта,"Літерний код валюти, в якій вказана вартість відповідно до ДСТУ ISO 4217:2010. Наприклад: UAH",string,True
unitName,Назва одиниці виміру,Назва одиниці виміру. Наприклад: куб. м.,string,True
wasteType,"Тип відходів, які приймаються","Вказуються типи відходів, які приймаються. Наприклад: тверді побутові відходи (не сортовані), скло, папір",string,True
containerType,Контейнерна система,Вказується тип системи збору відходів: контейнерна або безконтейнерна,string,True
isRecycling,Чи передбачений роздільний збір вторинних відходів для вторинної переробки,"Вказується, чи передбачений договором роздільний збір вторинної сировини. Якщо так, вказується True, якщо ні – False. Наприклад: True",boolean,True
