name,title,description,datatype,required
uid,Унікальний ідентифікатор,Вказується унікальний ідентифікатор скликання,string,True
label,Скликання,Вказується номер та назва скликання органу місцевого самоврядування. Наприклад: 6 скликання,string,True
dateFrom,Дата початку скликання,"Дата початку скликання, у форматі ISO 8601 (рррр-мм-дд). Наприклад: 2014-05-30",date,True
dateUntil,Дата завершення скликання,"Дата закінчення скликання, у форматі ISO 8601 (рррр-мм-дд). Наприклад: 2014-05-30",date,True
authorityName,Орган місцевого самоврядування,Вказується назва органу в якому проводиться засідання. Наприклад: Піщанська сільська рада ,string,True
authorityId,Код ЄДРПОУ,Код ЄДРПОУ органу в якому проводиться засідання. Наприклад: 01234567,string,True
CATUTTC,Код КАТОТТГ,Код КАТОТТГ адміністративної одиниці. Наприклад: UA32140050010021659,string,True
